{"type":"config","name":"smollm2.c — maximize decode tok/s vs Ollama","metricName":"tok_s","metricUnit":"","bestDirection":"higher"}
{"run":1,"commit":"34799b5","metric":27.8,"metrics":{"prefill_toks":29.72},"status":"keep","description":"Baseline: NEON F16 matmul 4-acc unroll-16, clang -O2 -march=native","timestamp":1781882409521,"segment":0,"confidence":null,"asi":{"hypothesis":"baseline measurement","ollama_ref_tok_s":21,"ollama_output":"I'm doing great! How can I help you today?","bottleneck":"matmul() called 210x per decode step, logit projection 49152x576 F32 also hot"}}
{"run":2,"commit":"34799b5","metric":27,"metrics":{"prefill_toks":33.48},"status":"discard","description":"-O3 -ffast-math: no improvement over -O2, within noise","timestamp":1781882443737,"segment":0,"confidence":null,"asi":{"hypothesis":"-O3 -ffast-math would improve throughput via auto-vectorization and fast math","result":"27.0 vs baseline 27.8, within noise, not a real improvement","rollback_reason":"no gain, compiler already vectorizing well at -O2 with NEON intrinsics","next_action_hint":"Compiler flags exhausted. Focus on algorithmic: precompute RoPE sin/cos table, or 8-accumulator matmul, or F16 KV cache"}}
{"run":3,"commit":"34799b5","metric":27.3,"metrics":{"prefill_toks":34.48},"status":"discard","description":"Precompute RoPE sin/cos table: no improvement, within noise","timestamp":1781882564459,"segment":0,"confidence":null,"asi":{"hypothesis":"RoPE powf/cosf/sinf per step was a bottleneck, precompute to save compute","result":"27.3 vs baseline 27.8 — within noise, no gain","rollback_reason":"RoPE was not the bottleneck. head_dim=64, n_heads=9, only 32 trig calls per token per layer — trivial vs matmul cost","next_action_hint":"matmul is the real bottleneck: 210 calls/step. Try 8-accumulator matmul or unroll-32 to improve NEON throughput. Also try F32 logit projection with NEON (currently matmul_f32 uses 2-acc unroll-8, could do 4-acc unroll-16)"}}
{"run":4,"commit":"34799b5","metric":20.4,"metrics":{"prefill_toks":27.97},"status":"discard","description":"2-row matmul tiling: slower (20.4 vs 27.8), register pressure hurts","timestamp":1781882625509,"segment":0,"confidence":null,"asi":{"hypothesis":"process 2 output rows simultaneously with 8 accumulators to hide FMA latency and better utilize NEON","result":"20.4 vs baseline 27.8 — significantly WORSE. 8 acc per output pair = too much register pressure on ARM64 (32 SIMD regs total, 8 float32x4 = 8 regs, x-vectors reloaded = cache thrash)","rollback_reason":"register spill and x-vector reload overhead outweigh FMA latency hiding","next_action_hint":"Single-row with 4 acc is optimal for this CPU. Try unroll-32 (2x the inner loop) to reduce loop overhead. Or try dot-product trick: vdotq_... not applicable for F32. Try vld1q_f16 + vcvtq_f32_f16 instead of vld1_f16+vcvt_f32_f16 to load 8 F16 at once. Also try matmul_f32 NEON upgrade (logit proj)."}}
{"run":5,"commit":"34799b5","metric":24.9,"metrics":{"prefill_toks":34.49},"status":"discard","description":"unroll-32 with vld1q_f16 + vget_low/high: slower than unroll-16 baseline","timestamp":1781882681078,"segment":0,"confidence":null,"asi":{"hypothesis":"wider loads (vld1q_f16 8 elements) and unroll-32 would reduce loop overhead and improve throughput","result":"24.9 vs baseline 27.8 — slower. 8 accumulators per row = register pressure even in single-row case","rollback_reason":"8 acc regs + 8 weight regs + x reloads = too much for ARM64 register file in single row. Original 4-acc unroll-16 is the sweet spot for this workload.","next_action_hint":"matmul inner loop already at sweet spot with 4-acc unroll-16. Focus elsewhere: (1) matmul_f32 logit projection is pure F32 49152x576 — try NEON with vld1q_f16 on x (currently F32), (2) attention inner loop (QK dot + softmax + weighted sum) — NEON vectorize, (3) SwiGLU loop — NEON sigmoid. (4) Try batching/prefetch hints __builtin_prefetch."}}
{"run":6,"commit":"ac67475","metric":28.3,"metrics":{"prefill_toks":27.94},"status":"keep","description":"matmul_f32 logit projection: 4-acc unroll-16 (was 2-acc unroll-8)","timestamp":1781882730422,"segment":0,"confidence":0.5555555555555542,"asi":{"hypothesis":"logit projection 49152x576 F32 was underutilizing NEON with 2-acc unroll-8, 4-acc unroll-16 better hides FMA latency","result":"28.3 vs baseline 27.8 — small but positive improvement (+0.5 tok/s)","confidence":"low, may be within noise, will re-run to confirm"}}
{"run":7,"commit":"ac67475","metric":27.5,"metrics":{"prefill_toks":38.14},"status":"discard","description":"Re-run confirm: matmul_f32 4-acc change is within noise (27.5 vs 27.8 baseline)","timestamp":1781882752196,"segment":0,"confidence":1,"asi":{"hypothesis":"confirming previous keep of matmul_f32 4-acc","result":"27.5 on re-run vs 28.3 first run vs 27.8 baseline — variance too high, no real gain","rollback_reason":"improvement was noise. Reverting to baseline.","next_action_hint":"Look at the attention inner loop (QK dot + value accumulation). Currently scalar float loops. Try NEON vectorization there. Also try SwiGLU sigmoid with NEON. Consider if there's a way to avoid recomputing full attention on every decode step."}}
{"run":8,"commit":"34799b5","metric":27.7,"metrics":{"prefill_toks":31.84},"status":"discard","description":"NEON attention QK dot + value acc + residual adds: noisy, avg ~27.7, not a clear win","timestamp":1781882847473,"segment":0,"confidence":1.249999999999999,"asi":{"hypothesis":"vectorize QK dot product, value accumulation, and residual adds with NEON to reduce scalar overhead","result":"3 runs: 28.5, 28.2, 26.5. Average ~27.7, baseline 27.8. High variance, no real gain.","rollback_reason":"SwiGLU NEON path is actually slower due to scalar-loop-in-NEON disguise (store/load to temp array then scalar expf). Residual adds are memory-bound not compute-bound. QK dot gain masked by variance.","next_action_hint":"Attention inner loop gains are marginal due to short hd=64 vectors. Focus on biggest flop blocks: ffn gate/up matmul [1536x576], down [576x1536] which run 30x per step. Try __builtin_prefetch for weight rows. Or try rmsnorm NEON (30x per step). Or profile to find true bottleneck."}}
{"run":9,"commit":"86747aa","metric":28.8,"metrics":{"prefill_toks":29.2},"status":"keep","description":"F16 logit projection: use w_token_embd_f16 (F16) instead of F32 for tied embedding logit proj — halves memory bandwidth for 49152x576 matmul","timestamp":1781883164212,"segment":0,"confidence":2,"asi":{"hypothesis":"logit projection is 18.9% of decode step. Using F16 weights halves memory bandwidth for this 49152x576 matmul (270MB/s saved), using existing NEON F16 matmul path","result":"3 runs: 28.8, 29.9, 28.2. Median 28.8. Baseline 27.8. +1 tok/s improvement. Consistent positive.","memory_note":"adds 49152*576*2 = 56.6MB F16 copy of w_token_embd in memory, was F32 only before","confidence":"reasonable, 3 runs all above baseline"}}
{"run":10,"commit":"86747aa","metric":27.4,"metrics":{"prefill_toks":31.1},"status":"discard","description":"NEON rmsnorm: within noise (26.8, 28.0 vs baseline 28.8 new baseline)","timestamp":1781883240602,"segment":0,"confidence":2.499999999999998,"asi":{"hypothesis":"NEON vectorize rmsnorm (called 60x per decode step: 30 attn + 30 ffn) to reduce scalar loop overhead","result":"26.8 and 28.0 — avg 27.4, below new baseline 28.8. RMSnorm is memory-bound for dim=576, scalar vs NEON doesn't matter much","rollback_reason":"rmsnorm cost is dominated by sqrtf/inverse, not the loops themselves. dim=576 is small enough the scalar loop is already fast.","next_action_hint":"Focus on memory bandwidth: the main matmul is 210 calls per step over ~130MB of weights total. Try prefetch hints for weight rows to pipeline memory access. Or try quantizing KV cache to F16 to reduce memory bandwidth for attention. Or try avoiding the double decode of x in rmsnorm (compute in-place)."}}
{"run":11,"commit":"86747aa","metric":26.6,"metrics":{"prefill_toks":37.6},"status":"discard","description":"prefetch next weight row: slower (25.7, 27.5) vs baseline 28.8, prefetch distance too short or OS already prefetches","timestamp":1781883331554,"segment":0,"confidence":2.4999999999999867,"asi":{"hypothesis":"__builtin_prefetch 2 rows ahead to overlap L2 miss latency for weight access in matmul","result":"25.7, 27.5 — worse than baseline 28.8. Prefetch with distance=2 is too short, creates cache contention.","rollback_reason":"the OS/HW prefetcher on this Snapdragon likely already handles sequential access. Adding software prefetch creates contention.","next_action_hint":"Software prefetch ineffective here. Try larger prefetch distance (4-8 rows) as separate experiment, or skip. Consider: can we reduce total weight bytes loaded? KV cache F16 compression would save attention bandwidth. Try F16 KV cache (pack k/v as F16 to halve bandwidth in attention)."}}
{"run":12,"commit":"86747aa","metric":25.1,"metrics":{"prefill_toks":35.7},"status":"discard","description":"F16 KV cache: slower (24.7, 25.4) vs baseline 28.8 — F16 decode in attention inner loop costs more than bandwidth saved","timestamp":1781883505048,"segment":0,"confidence":1.6666666666666676,"asi":{"hypothesis":"F16 KV cache halves memory bandwidth for attention (kv_dim=192, pos=50 tokens → ~19KB saved per step), enabling faster attention","result":"24.7, 25.4 — significantly worse than baseline 28.8. The KV cache is tiny (30 layers * 50 pos * 192 dim * 4B = 1.1MB F32) — fits in L2/L3 cache entirely. F16 decode overhead (vcvt per element in QK dot + value accum) adds cost with no bandwidth benefit when data is already cached.","rollback_reason":"KV cache is small enough to be L2-cached. F32→F16→F32 round-trip adds latency with no memory bandwidth benefit.","next_action_hint":"KV cache compression not beneficial here. The weights are the bottleneck, not KV cache. Attention itself is a tiny fraction of compute vs matmul. Focus on: (1) try -O3 specifically for forward.c only, (2) try loop unrolling of matmul inner loop with pragma, (3) try aligning weight arrays to 64B for better cache line utilization, (4) measure Ollama actual tok/s and compare properly."}}
{"run":13,"commit":"86747aa","metric":25.4,"metrics":{"prefill_toks":33.49},"status":"discard","description":"-O3 for forward.c only: slower than -O2 (25.4 vs 28.8)","timestamp":1781883644306,"segment":0,"confidence":1.42857142857143,"asi":{"hypothesis":"-O3 might auto-vectorize loops better than -O2 when applied only to the hot forward.c file","result":"25.4 vs baseline 28.8. Worse. -O3 may unroll loops in ways that thrash icache, or miscompile NEON intrinsics.","rollback_reason":"-O2 with manual NEON intrinsics outperforms -O3 auto-vectorization for this workload","next_action_hint":"Compiler path exhausted. Think differently: (1) Reduce number of matmul calls — currently q/k/v are separate, could fuse into one [q+k+v] * x matmul. For decode step, dim=576, q=576, k=192, v=192 = 960 outputs. Fused = 1 loop over x instead of 3. (2) Fuse gate+up FFN matmul similarly. (3) Measure actual time per matmul call with perf counters if possible."}}
{"run":14,"commit":"86747aa","metric":26.7,"metrics":{"prefill_toks":39.33},"status":"discard","description":"qkv_buf + matmul_qkv prep (no actual fusing yet): within noise, no gain","timestamp":1781883738426,"segment":0,"confidence":1.6666666666666627,"asi":{"hypothesis":"prep for fused QKV: added qkv_buf allocation and matmul_qkv wrapper. No actual loop fusion implemented yet.","result":"26.7 vs baseline 28.8 — slightly worse within noise. No change to hot path.","rollback_reason":"no improvement, reverting. True QKV fusion requires single loop over x computing q/k/v rows together — complex and risky for marginal gain given each matmul already independently vectorized.","next_action_hint":"QKV fusion is complex for small gain. Different angle: measure if the benchmark itself is noisy due to CPU freq scaling. Try pinning to performance cores or running under taskset. Also: profile with perf stat to get actual cycle counts and cache miss rates. Or try a completely different approach: implement BLAS-like blocked matrix multiplication to improve cache utilization."}}
{"run":15,"commit":"bcd8fa3","metric":24.5,"metrics":{"prefill_toks":31.3},"status":"keep","description":"Re-baseline with warmup: steady-state is 24.5 tok/s (not 28.8 which was burst freq)","timestamp":1781884290881,"segment":0,"confidence":1.249999999999999,"asi":{"hypothesis":"establish true steady-state baseline after CPU frequency throttling characterization","result":"True steady-state: ~24.5 tok/s. Earlier 28.8 was burst CPU freq on first run. The F16 logit proj improvement is still kept as it was real (+1 tok/s vs true F32 baseline ~23-24).","benchmark_insight":"CPU throttles after ~2 runs from 3GHz to ~2.4GHz sustained. Warmup 2 runs before measuring captures steady-state. Noise floor now ~1 tok/s.","ollama_comparison":"Ollama steady-state: 13.7 tok/s. We are 1.8x faster."}}
{"run":16,"commit":"86747aa","metric":10,"metrics":{"prefill_toks":0},"status":"discard","description":"pthread thread pool for matmul: catastrophically slower (5-11 tok/s) due to per-matmul sync overhead","timestamp":1781884736447,"segment":0,"confidence":0.8333333333333338,"asi":{"hypothesis":"parallel matmul rows across 4 threads to multiply effective memory bandwidth","result":"10 tok/s vs baseline 24.5. 210 matmul calls * mutex/cond overhead per call = ~20ms extra per step. Threading only helps when work per call >> sync overhead.","rollback_reason":"mutex/cond sync overhead ~100us per matmul. 210 calls = 21ms added. Single-token decode has too little work per matmul to amortize sync cost.","next_action_hint":"Threading needs coarser granularity. Options: (1) thread the logit projection only (49152 rows, 1 call = 7ms, enough to amortize). (2) Thread per-layer (one sync per layer = 30 syncs) but each thread does ALL 7 matmuls for different row-slices. (3) Abandon threading, try INT8 weight quantization to halve bandwidth."}}
{"run":17,"commit":"86747aa","metric":12.5,"metrics":{"prefill_toks":0},"status":"discard","description":"pthread_create per token for logit projection: 12 tok/s, thread creation cost dominates","timestamp":1781884857534,"segment":0,"confidence":0.7692307692307688,"asi":{"hypothesis":"parallelize only logit projection (49152 rows, one call) with 4 fresh threads per token to save 8ms/step","result":"12 tok/s. pthread_create ~200us * 4 threads = 0.8ms, but actual overhead much higher. Thread creation/TLS/OS scheduling adds >20ms per step.","rollback_reason":"pthread_create per token is too expensive. Need persistent thread pool, but mutex/cond overhead was also too high (exp16 showed that).","next_action_hint":"Threading definitively too expensive for this workload granularity. We are near the single-core memory bandwidth limit (5 GB/s, 202MB weights = 24.7 tok/s theoretical). Options: (1) INT8 quantization to halve memory footprint (complex but 2x potential), (2) accept current result and improve quality instead."}}
{"run":18,"commit":"86747aa","metric":19,"metrics":{"prefill_toks":0},"status":"discard","description":"Persistent thread pool for logit projection (N_PAR=2,4): slower than baseline, mutex/cond wakeup + memory contention costs outweigh parallel benefit","timestamp":1781885113728,"segment":0,"confidence":0.714285714285715,"asi":{"hypothesis":"persistent threads that sleep between tokens + ONE sync point per step should parallelize logit projection (18% of step) with low overhead","result":"18-20 tok/s with N_PAR=2 or N_PAR=4. Baseline 24.5. Mutex/cond wakeup cost on Android ~200us per thread * 2-4 threads = 0.4-0.8ms. Context switch overhead + cache coherence + memory bus contention all add up. Logit proj speedup: yes (56MB / 4 = 14MB per thread), but synchronization overhead negates the gain.","rollback_reason":"Any threading approach adds more overhead than benefit for this 41ms decode step. The logit projection parallelization saves ~5ms but adds ~8-12ms in sync overhead on Android mobile.","next_action_hint":"Threading definitively does not work on this platform/workload. Final options: (1) INT8 quantization of weights (complex but 2x potential), (2) accept 24.5 tok/s as optimal for single-thread F16, (3) try batch decode (process 2+ tokens at once in prefill-like fashion during autoregressive generation). Batch decode could help throughput if user tolerates latency."}}
{"run":19,"commit":"86747aa","metric":20,"metrics":{"prefill_toks":0},"status":"discard","description":"INT8 per-block-64 quantization: argmax correct but 18-23 tok/s vs 24.5 baseline. Int8->float dequant overhead negates bandwidth savings.","timestamp":1781885595846,"segment":0,"confidence":0.6666666666666666,"asi":{"hypothesis":"INT8 weight quantization halves memory bandwidth (202MB->101MB). Expected 2x speedup on memory-bound workload.","result":"18-23 tok/s vs baseline 24.5. SLOWER. The INT8->F32 dequant path (int8->int16->int32->float) costs more than F16->F32 (single vcvt). 3 widening ops vs 1 for F16.","rollback_reason":"F16 is already an efficient format for this CPU. INT8 with float activations adds dequant overhead. Only vdotq_s32 (INT8 activations+weights) could win, but that requires quantizing activations too.","next_action_hint":"INT8 quantization definitively slower without vdotq_s32. To use vdotq_s32 need INT8 activations: quantize x per token to INT8, do INT8 dot product, scale result. This is complex and risky for accuracy. We've exhausted all major optimization paths. Current 24.5 tok/s is 1.8x faster than Ollama 13.7 tok/s. Focus on improving quality instead of speed."}}
{"run":20,"commit":"bcd8fa3","metric":21.5,"metrics":{"prefill_toks":28.75},"status":"discard","description":"4-row output tiling: 21.3-21.5 tok/s, same as device throttled baseline - no clear improvement","timestamp":1781886002110,"segment":0,"confidence":0.6250000000000001,"asi":{"hypothesis":"process 4 output rows at a time sharing x-vector loads from L1 to reduce x reload overhead and improve DRAM burst efficiency","result":"21.3-21.5 tok/s. But device is CPU-throttled now vs 24.5 baseline measured earlier. Cannot distinguish improvement from noise. Cautiously discard since 4-row tiling tried in exp#4 was already slower (register pressure). This variant might be slightly better but register count is still high: 16 float32x4_t accumulators + 4 x loads + 16 weight loads = 36 SIMD regs needed, exceeds ARM64 32-reg file.","rollback_reason":"Register pressure from 16 accumulators likely causes spills. Result ambiguous due to thermal throttling.","next_action_hint":"System is thermally throttled. No more optimization headroom on this device right now. The 24.5 tok/s was the true steady-state result. F16 logit projection is the only confirmed improvement. Consider writing final summary."}}
{"run":21,"commit":"bbd14ee","metric":23.5,"metrics":{"prefill_toks":25},"status":"discard","description":"2-row logit matmul tiling: not better than baseline. Direct A/B shows baseline 24-25.6 tok/s vs 2-row 20-24 tok/s.","timestamp":1781886636824,"segment":0,"confidence":0.4761904761904759,"asi":{"hypothesis":"2-row tiling for logit projection (49152x576) amortizes x-vector L1 loads across 2 output rows, improving DRAM burst utilization","result":"WORSE or equal. Baseline without tiling: 24.1-25.6 tok/s (avg ~24.9). With 2-row: 20.1-26.9 tok/s (avg ~23.5). Direct A/B comparison on same device at similar thermal state. x is already in L1 cache for baseline. DRAM bottleneck is reading W rows - tiling does not help because you still read 2x more W bytes total. Register pressure from 8 accumulators + interleaved loads disrupts pipeline.","rollback_reason":"Tiling does not help when bottleneck is W-row bandwidth, not x-vector reloads. Baseline 4-acc 1-row loop is already optimal for this access pattern.","next_action_hint":"2-row tiling confirmed worse for logit matmul. Single-row 4-acc is optimal. We are at the memory bandwidth limit. No further single-core optimization is likely to succeed. Session approaching conclusion."}}
{"run":22,"commit":"cd64552","metric":44,"metrics":{"prefill_toks":32},"status":"keep","description":"vdotq_s32 INT8 activation+weight quantization: 40-49 tok/s (median ~44). vs 24.5 baseline = +79% improvement! argmax=504 correct.","timestamp":1781887216402,"segment":0,"confidence":9.257142857142856,"asi":{"hypothesis":"INT8 activations + INT8 weights using vdotq_s32 ARM dotprod instruction. Quantize x_norm per step, use per-row INT8 weight scales. 4x less weight bytes + 4x compute throughput vs F16.","result":"MASSIVE WIN. 40-49 tok/s (median ~44) vs 24.5 baseline = +79%. Microbench confirmed 2.8-4.9x speedup before implementation. Benchmark measures 43-46 tok/s median. argmax=504 correctness gate passes. Ollama is 13.7 tok/s, we are now 3.2x faster.","key_insight":"F16->F32 convert has ~1 cycle per 4 elements on Cortex-A55. INT8->INT32 via vdotq_s32 has 4 dot products per cycle per accumulator = 16x more multiply-adds per cycle. Plus 4x less DRAM bandwidth for weights (INT8 vs F16). Combined effect: ~4-5x speedup.","next_action_hint":"This is the big win. Now explore: (1) also quantize logit projection to INT8, (2) quantize prefill too, (3) tune activation quantization (block-wise instead of per-tensor), (4) verify output quality matches."}}
