{"run":23,"commit":"031d794","metric":55,"metrics":{"prefill_toks":37},"status":"keep","description":"INT8 logit projection via vdotq_s32: 52-58 tok/s (median ~55) vs 44 previous. +25% on top of exp22. vs baseline 24.5 = +124%. argmax=504 correct.","timestamp":1781887494628,"segment":0,"confidence":15.999999999999973,"asi":{"hypothesis":"Apply same INT8 vdotq_s32 approach to logit projection (49152x576). Quantize x_norm to INT8 per-step, use pre-quantized INT8 token embeddings. Logit projection = 21% of total step cost.","result":"52-58 tok/s (median ~55). Previous INT8 decode step was 43-46 tok/s. Additional +25% improvement from logit projection INT8. vs original baseline 24.5 = +124% total improvement. argmax=504 passes. Logit value changed (36.06 -> 34.51) due to INT8 quantization error but argmax unchanged.","key_insight":"INT8 token_embd logit projection (27MB INT8 vs 54MB F16) + vdotq_s32 converts the 2nd biggest matmul (21% of compute) to ultra-fast path.","next_action_hint":"Now at 55 tok/s vs Ollama 13.7 = 4x faster. Further improvements: (1) tune activation quantization to per-block-32 instead of per-tensor (better accuracy, small overhead), (2) block-wise weight quantization, (3) check output quality with temp=0 generation."}}
{"run":24,"commit":"0c5d696","metric":60,"metrics":{"prefill_toks":41},"status":"keep","description":"INT8 per-block-64 quantization: 59-61 tok/s. Same speed as per-tensor, better accuracy. vs baseline 24.5 = +145%. 4.4x faster than Ollama.","timestamp":1781888508022,"segment":0,"confidence":16.51282051282052,"asi":{"hypothesis":"Replace per-tensor activation quantization with per-block-64 for better accuracy without speed loss. Weight scales also upgraded to per-block-64 for matching precision.","result":"59-61 tok/s (median ~60). Same speed as per-tensor INT8 (57-59 from exp23). Better accuracy: per-block-64 prevents crushing small activations. argmax=504 passes. vs baseline 24.5 = +145%. vs Ollama 13.7 = 4.4x faster.","key_insight":"Per-block-64 adds 9 scale multiplications vs 1 per output row, but this is tiny vs 576 vdotq_s32 calls. Speed is identical. Quality is preserved better for activations with uneven distributions.","next_action_hint":"Now at 60 tok/s. Further improvements: (1) try larger block sizes (128 instead of 64) - fewer scale reads, (2) try unrolling the block loop, (3) explore if prefill can also use INT8, (4) consider reducing Q8_BLOCK to 32 for even better quality at slight speed cost."}}
{"run":25,"commit":"83ffb36","metric":52,"metrics":{"prefill_toks":38},"status":"keep","description":"Confirming per-block-64 INT8: 51-52 tok/s steady-state (device throttled). vs F16 baseline 24.5 = +112%. 3.8x faster than Ollama.","timestamp":1781888990660,"segment":0,"confidence":15.333333333333325,"asi":{"hypothesis":"Confirming steady-state performance of per-block-64 INT8 at full thermal throttle","result":"51-52 tok/s (device throttled). True steady state. Both per-tensor and per-block give similar speed. Per-block has better accuracy.","note":"Previous 59-61 measurements included CPU boost frequency. True steady-state is 51-55 tok/s depending on device thermal state. Still 2.1x+ faster than our original baseline (24.5 tok/s).","next_action_hint":"Speed is CPU-thermal-limited not algorithmic. Quality: per-block-64 activation + weight quant gives robust quantization. No more obvious low-hanging fruit. Update autoresearch docs."}}
{"run":26,"commit":"83ffb36","metric":52.6,"metrics":{"prefill_toks":36},"status":"discard","description":"vmlaq_n_f32 float accumulation across blocks: same speed as scalar block loop (52-53 tok/s). No gain from vectorising the block accumulation.","timestamp":1781889203252,"segment":0,"confidence":14.976744186046497,"asi":{"hypothesis":"Replace per-block scalar float accumulation with vmlaq_n_f32 (vector float FMA) to avoid horizontal reduction overhead and keep 4 float lanes summed once at end.","result":"52-53 tok/s identical to baseline. The compiler already does similar vector ops. The block loop overhead is dominated by memory latency not compute.","rollback_reason":"No improvement over current per-block-64 code at 52 tok/s.","next_action_hint":"The per-block approach has hit its ceiling. Try reducing Q8_BLOCK to 32 for better quality, or try a fundamentally different path: lazy logit projection (only compute top-K rows instead of all 49152)."}}
{"run":27,"commit":"bcd9f55","metric":57,"metrics":{"prefill_toks":44},"status":"keep","description":"NEON activation quantize: vectorised abs-max scan + vcvtnq+vmovn pack. 52-57 tok/s (CPU boost). Correctness preserved (argmax=504, logit=36.0).","timestamp":1781889321406,"segment":0,"confidence":12.88,"asi":{"hypothesis":"NEON vectorise quantize_row_to_q8_blocked: abs-max with 4-wide vmaxq, quantize with vcvtnq_s32_f32 + vmovn packing. Reduces activation quantize time for 121 calls per decode step.","result":"52-57 tok/s. Slight improvement visible in second run (57 tok/s vs 52 tok/s before). Logit changed from 35.5 to 36.0 due to vcvtnq rounding (still argmax=504, quality preserved).","key_insight":"NEON activation quantize is beneficial - 121 calls per decode step at 576-1536 elements each adds up. The vectorised path processes 16 floats per iteration vs 1 scalar.","next_action_hint":"Try NEON vectorise quantize_f16_rows_to_q8 (weight quantization at load time) - called 210 times at load but already fast enough. Try attention inner loop optimizations. Or try reducing logit projection cost via top-K approximation."}}
{"run":28,"commit":"9f9ac24","metric":56,"metrics":{"prefill_toks":37},"status":"keep","description":"NEON rmsnorm: 4-acc vfmaq for squared sum + vectorised scale-mul. 56 tok/s consistent. vs 52-54 before. rmsnorm called 60x per decode step.","timestamp":1781889818250,"segment":0,"confidence":10.222222222222229,"asi":{"hypothesis":"NEON vectorise rmsnorm: 4 accumulators for squared-sum, vectorised output scale. Called 60x per decode step at dim=576.","result":"56 tok/s stable (two consecutive runs: 56.5, 56.3). Slight improvement over 52-54 tok/s baseline. rmsnorm vectorisation reduces scalar loop overhead.","key_insight":"rmsnorm has non-trivial cost even though it seems cheap: 60 calls * 576 elements * (sq + sqrt + scale) = meaningful FP work at single-core level.","next_action_hint":"Try NEON for the residual add loops (30x attn + 30x ffn per step, each 576 elements). Also try INT8 decode for prefill path. Or look at further improvements to quantize_f16_rows_to_q8 at load time."}}
{"run":29,"commit":"db7b8ad","metric":56.5,"metrics":{"prefill_toks":50},"status":"keep","description":"NEON attention QK dot + value weighted sum: vfmaq 4-acc for dot, vfmaq_n broadcast for value. argmax=504 preserved. Decode tok/s ~56 steady state.","timestamp":1781890167106,"segment":0,"confidence":8.473684210526315,"asi":{"hypothesis":"Vectorise QK dot product (4-acc vfmaq) and value weighted sum (broadcast vfmaq_n) in decode attention. Microbench showed 2.34x speedup. Expected ~2.7% step improvement.","result":"56.2-56.8 tok/s. Slight improvement visible but within noise. Attention was already small fraction of step (0.85ms of 18ms = 4.7%). Still worth keeping as cleaner/faster code.","key_insight":"Attention vectorisation: 0.85ms -> 0.37ms per step. At 56 tok/s, total step = 17.9ms. Savings = 0.48ms = 2.7% improvement expected. Measured improvement is within noise due to thermal variance.","next_action_hint":"Prefill path (forward_prefill) still uses F16 matmul. Could use INT8 there too for faster prompt processing. Or try INT4 logit projection (5% potential, high risk for argmax=504)."}}
{"run":30,"commit":"95803a4","metric":75,"metrics":{"prefill_toks":81},"status":"keep","description":"INT8 prefill: swap F16 matmul for q8 matmul_q8_dot in forward_prefill. 73-77 tok/s! +30% vs 56 tok/s. argmax=504 preserved (logit=35.6).","timestamp":1781890361321,"segment":0,"confidence":9.731958762886595,"asi":{"hypothesis":"Use INT8 (q8_*) weights in the prefill path instead of F16 matmul. Primary goal: faster prefill. Secondary: cache footprint unified (INT8 only, no F16 warmup polluting L2/L3).","result":"73-77 tok/s (3 consecutive runs: 76.3, 73.0, 77.3). Massive improvement! vs 56 tok/s baseline = +34%. vs original 27.8 = +170%. vs Ollama 13.7 = 5.5x faster. Prefill also improved: 60-94 tok/s prefill.","key_insight":"The F16 prefill path was reading 202MB of F16 weights, evicting the 102MB INT8 weight arrays from L2/L3 cache. The 2 warmup decode runs didn't fully warm the cache before the 5 measured runs. Unifying to INT8-only removes this cache pollution effect.","next_action_hint":"Now at 75 tok/s. Can we free the F16 weight arrays after quantization? They're 202MB that's no longer needed. This would reduce memory usage and potentially improve cache efficiency further. Also: try running more consecutive benchmarks to confirm steady-state."}}
{"run":31,"commit":"7219f91","metric":76,"metrics":{"prefill_toks":105},"status":"keep","description":"Free F16 weight arrays after INT8 quantization: saves 202MB RAM, reduces memory pressure. 74-77 tok/s. Prefill 95-114 tok/s.","timestamp":1781890462992,"segment":0,"confidence":8.169491525423732,"asi":{"hypothesis":"Free w_q/w_k/w_v/w_o/w_gate/w_up/w_down/w_token_embd_f16 after INT8 quantization. Inference no longer needs F16 arrays. Saves 202MB RAM and reduces OS memory pressure on Android.","result":"74-77 tok/s (two runs: 74.8, 77.3). Consistent with previous 75 tok/s. Prefill greatly improved: 95-114 tok/s. argmax=504 preserved.","key_insight":"Freeing 202MB of F16 arrays allows OS to keep 102MB INT8 arrays in physical RAM without competition. On Android where swap is limited, this improves sustained throughput.","next_action_hint":"Memory is now optimal. Speed is 76 tok/s vs 27.8 baseline = +173%. Try: (1) longer benchmark to confirm thermal steady state, (2) update ideas.md, (3) consider if there are any remaining scalar loops."}}
{"run":32,"commit":"3fcbed3","metric":79,"metrics":{"prefill_toks":83},"status":"keep","description":"Reverted INT4 FFN attempt (argmax failed). Confirmed steady state at 79 tok/s (two runs: 79.8, 79.3). CPU in boost. vs baseline 27.8 = +184%.","timestamp":1781890960012,"segment":0,"confidence":7.876923076923077,"asi":{"hypothesis":"INT4 for gate/up/down FFN matrices: half weight bytes, expected 5-8% speedup.","result":"argmax changed to 39059 (expected 504). INT4 quantization too coarse for 135M model FFN weights. 4-bit * per-block-64 activation error accumulates over 30 layers causing garbage output.","rollback_reason":"argmax=504 correctness gate failed. SmolLM2-135M is too small for INT4 FFN quantization without careful calibration.","note":"After revert, confirmed 79 tok/s (device in good thermal state). This is our true peak with current approach.","next_action_hint":"INT4 definitively too coarse for this model. We've hit the ceiling for single-core INT8 vdotq. Consider: asymmetric INT4 with careful calibration (complex), or accept current 76-79 tok/s as optimal."}}
{"run":33,"commit":"7461fbb","metric":83,"metrics":{"prefill_toks":111},"status":"keep","description":"Fast sigmoid (Schraudolph bit trick): 10x faster than libm expf. SiLU loop: 0.262ms->0.024ms per 30 layers. 82-84 tok/s. argmax=504 preserved (logit=35.59).","timestamp":1781891131747,"segment":0,"confidence":7.774647887323942,"asi":{"hypothesis":"Replace expf(-g) in SwiGLU with Schraudolph bit-manipulation fast exp: e^x = cast(12102203.1875*x + 1065353216). 10x faster than libm. ~1.7% error, acceptable for sigmoid gate.","result":"82-84 tok/s (up from 76-79). Clear improvement! 30-layer SiLU: 0.262ms -> 0.024ms = 0.238ms savings per step. At 12.7ms step: 1.9% expected, measured ~5% (thermal variation helps too).","key_insight":"libm expf on Cortex-A55 takes ~50 cycles. Fast exp via IEEE float bit manipulation takes ~5 cycles. For 46080 calls per decode step: 46080 * 45 cycles saved = 2.1M cycles = 1.05ms at 2.0 GHz.","next_action_hint":"Also apply fast_sigmoid to softmax expf in attention? Currently uses expf for scores. 30 layers * 9 heads * pos tokens expf calls. For pos=50: 13500 expf calls. Savings: 13500*45=607K cycles=0.3ms."}}
{"run":34,"commit":"43c6347","metric":84,"metrics":{"prefill_toks":108},"status":"keep","description":"fast_expf in attention softmax (prefill + decode): 82-85 tok/s. Marginal gain from attention softmax (was expected 0.15ms savings). Argmax=504 preserved (logit=35.51).","timestamp":1781891237697,"segment":0,"confidence":7.594594594594593,"asi":{"hypothesis":"Apply fast_expf (Schraudolph bit trick) to attention softmax expf calls. 30 layers * 9 heads * ~25 tokens = 6750 expf calls/step. Expected 0.15ms savings.","result":"82-85 tok/s (vs 82-84 before). Very marginal improvement, within noise. The attention softmax contribution is small (6750 calls vs 46080 SiLU calls). argmax=504 preserved.","key_insight":"Softmax expf are fewer (6750 vs 46080 SiLU) and shorter sequences. The fast_expf bit trick still applies correctly here: normalized softmax inputs (score - max_s) have better numerical properties.","next_action_hint":"Most major optimizations exhausted. Consider: (1) RoPE precompute (tried before, within noise), (2) final rmsnorm + quantize could be fused into one NEON pass, (3) check if there are any remaining libm calls."}}
{"run":35,"commit":"d6dc213","metric":89,"metrics":{"prefill_toks":105},"status":"keep","description":"Precomputed RoPE cos/sin table: 87-90 tok/s! Eliminated 34560 libm calls per step (30*(9+3)*32*(powf+cosf+sinf)). vs 83 before = +7%.","timestamp":1781891524460,"segment":0,"confidence":7.948051948051949,"asi":{"hypothesis":"Precompute RoPE cos/sin table at load time (max_seq*head_dim/2 = 512*32 = 131KB). Replace powf/cosf/sinf per decode step with table lookup.","result":"87-90 tok/s (two runs: 87.9, 89.5). Clear improvement vs 82-84 before. 34560 libm calls eliminated: 34560 * ~50 cycles = 1.73M cycles = 0.87ms saved. 7% step improvement matches expected.","key_insight":"With decode now being very fast (12ms step), the 0.87ms from RoPE trig was 7% of budget. Table precompute at load time (one-time cost) eliminates this entirely. Was tried before but dismissed when decode was BW-limited at 17ms.","next_action_hint":"At 89 tok/s. Remaining: check if there are other scalar loops. Consider NEON vectorization of rope_neox_table (32 rotations per head, hd/2=32 floats). Also: review the softmax to see if there's more to gain."}}
{"run":36,"commit":"dc1cb4e","metric":95,"metrics":{"prefill_toks":111},"status":"keep","description":"Per-tensor activation quantization: single float x_scale vs per-block-64. 95 tok/s (both runs: 95.5, 95.0). vs 89 before = +6.7%. argmax=504 preserved (logit=34.81).","timestamp":1781892462692,"segment":0,"confidence":8.145454545454546,"asi":{"hypothesis":"Switch activation quantization from per-block-64 (array of 9 scales) to per-tensor (single global scale). Weight quantization stays per-block-64. Matmul: result = (sum_b dot_b * ws_b) * x_scale. Faster quantize (1 scan vs 9 blocks) + faster matmul (1 multiply outside loop vs 9 inside).","result":"95 tok/s (both runs 95.0 and 95.5). Clear improvement vs 89 tok/s = +6.7%. logit changed slightly (35.51->34.81) but argmax=504 preserved. Per-tensor activation with per-block weight is a good quality/speed tradeoff.","key_insight":"Per-block activation quantize: 9 iterations with hadd+scale per block. Per-tensor: 1 global scan, then 1 scale per output row instead of 9. Savings: 120 quantize calls * (per-block overhead eliminated). Plus matmul: 9 scale muls per row -> 1 scale mul per row for each of 49152+210*30=6510 output rows.","next_action_hint":"Now at 95 tok/s. vs original 27.8 = +242%. Next: can we further reduce matmul overhead? Or look at the weight quantization and check if per-block-64 weight scale is still needed for quality."}}
{"run":37,"commit":"b59284e","metric":97,"metrics":{"prefill_toks":107},"status":"keep","description":"Per-row logit weight scale: tight matmul_q8_dot_perrow for 49152x576 (no per-block hadd loop). 96-98 tok/s. argmax=504 preserved.","timestamp":1781892644649,"segment":0,"confidence":7.863636363636363,"asi":{"hypothesis":"Switch logit projection weights from per-block-64 scale to per-row scale. Eliminates 9 hadd+scale iterations per row in the 49152x576 matmul. Uses matmul_q8_dot_perrow: tight inner loop over all 576 elements with ONE final scale multiply.","result":"96-98 tok/s (two runs: 97.8, 96.6). Marginal improvement vs 95 tok/s (~2%). logit changed slightly (34.81->34.81) but argmax=504 preserved. Per-row quantization acceptable for logit projection (embedding vectors tend to have similar magnitude across dimensions).","key_insight":"Per-row weight scale: 9 hadd+fmul -> 1 hadd+fmul per output row. For 49152 rows: saves 49152 * 8 = 393K float operations. Also saves 1.77MB->192KB scale data bandwidth.","next_action_hint":"Now apply per-row scale to ALL weight matrices (not just logit). q/k/v/o/gate/up/down. This will reduce scale data from ~2MB to ~100KB per step and eliminate per-block hadd overhead everywhere."}}
{"run":38,"commit":"43a6acd","metric":100,"metrics":{"prefill_toks":116},"status":"keep","description":"Per-row weight scale for ALL matrices: tight matmul_q8_dot_perrow everywhere. 99-101 tok/s! vs 97 before = +3%. vs baseline 27.8 = +260%. argmax=504 preserved (logit=34.54).","timestamp":1781892851264,"segment":0,"confidence":5.869918699186992,"asi":{"hypothesis":"Switch ALL transformer weight matrices (q/k/v/o/gate/up/down) from per-block-64 scale to per-row scale. Same as logit projection (already done). Eliminates all per-block hadd overhead from matmul inner loops.","result":"99-101 tok/s (two runs: 99.3, 101.0). Consistent improvement vs 96-98 tok/s. Scale data reduced from ~6.7MB to ~615KB per step. Tight inner loop with no per-block branching.","key_insight":"Per-row scale removes the block iteration from matmul, leaving a single tight vdotq_s32 loop over all in_dim elements. One hadd + one scale multiply per output row instead of n_blocks each.","next_action_hint":"We're at 100 tok/s! vs 27.8 baseline = 3.6x. Further: check if there's any remaining per-block loop overhead. Try unrolling the matmul inner loop with unroll-2 (process 128 bytes per iter). Or look at the xq_buf zero-padding overhead."}}
{"run":39,"commit":"c630d06","metric":102,"metrics":{"prefill_toks":102},"status":"keep","description":"Unroll vdotq inner loop 2x (128 bytes per iter vs 64): 101-102 tok/s. Marginal gain. argmax=504 preserved.","timestamp":1781893033809,"segment":0,"confidence":4.726114649681529,"asi":{"hypothesis":"Process 128 bytes per loop iteration (8 vdotq) instead of 64 bytes (4 vdotq). Reduces loop overhead for 576-element rows (9 iters of 64 -> 4 iters of 128 + 1 of 64).","result":"101-102 tok/s (two runs: 102.4, 101.5). Marginal improvement vs 99-101 tok/s. For in_dim=576: 4 full 128-byte iters + 1 64-byte iter = 5 total loop iterations (vs 9 before). Slightly less overhead.","key_insight":"For FFN input dim=1536: 12 * 64-byte = 12 iters, vs 6 * 128-byte = 6 iters. Benefit is real but small since memory access dominates loop overhead.","next_action_hint":"We're at 102 tok/s, 3.7x faster than baseline. Look at: xq_buf zero-padding is unnecessary with per-tensor activation (the padding was for per-block-64 which needed block boundaries). Can we remove it?"}}
{"run":40,"commit":"a19e527","metric":101,"metrics":{"prefill_toks":106},"status":"keep","description":"Confirming steady state: 99-102 tok/s. 3.6x faster than baseline 27.8. 7.4x faster than Ollama 13.7.","timestamp":1781893191697,"segment":0,"confidence":4.711111111111111,"asi":{"hypothesis":"Confirming steady-state performance after all optimizations.","result":"99-102 tok/s (two runs: 102.2, 99.1). Median ~100.7 in 10-run test. Device stable.","summary":"Full optimization stack: INT8 vdotq_s32, per-row weight+activation scale, tight matmul loop, NEON rmsnorm, NEON attention, NEON quantize, precomputed RoPE, fast_expf, freed F16 weights, INT8 prefill, per-tensor activation.","next_action_hint":"Session at peak. Consider cleaning up dead code (matmul_q8_dot, quantize_row_to_q8_blocked, matmul_q4_dot, quantize_f16_rows_to_q4) and updating documentation."}}
{"run":41,"commit":"9213586","metric":103,"metrics":{"prefill_toks":126},"status":"keep","description":"Clean up dead code: removed per-block matmul, blocked weight quantize functions. 103 tok/s. vs baseline 27.8 = +271%.","timestamp":1781893414962,"segment":0,"confidence":4.613496932515337,"asi":{"hypothesis":"Remove dead code: matmul_q8_dot (per-block), matmul_q4_dot, quantize_f16_rows_to_q8 (per-block), quantize_row_to_q8_blocked. Smaller binary, cleaner code, same performance.","result":"103.2 tok/s (slight improvement from cleaner icache?). Confirms 100-103 tok/s stable. vs baseline 27.8 = +271%. vs Ollama 13.7 = 7.5x faster.","next_action_hint":"At ceiling. Further gains require: INT4 (quality fails), threading (overhead too high), or new algorithms. Consider finalizing the autoresearch session."}}
{"run":42,"commit":"e417ab1","metric":101.8,"metrics":{"prefill_toks":119},"status":"keep","description":"Final session state: 101.8 tok/s. vs baseline 27.8 = +266%. vs Ollama 13.7 = 7.4x faster. argmax=504. All major optimizations applied.","timestamp":1781893547918,"segment":0,"confidence":4.449704142011835,"asi":{"hypothesis":"Final verification run after documentation update.","result":"101.8 tok/s. Consistent with 100-105 tok/s range. Session complete.","final_summary":"Started at 27.8 tok/s. Final: 101.8 tok/s (+266%). Key wins: (1) INT8 vdotq_s32 +170%, (2) INT8 prefill +30%, (3) per-tensor/per-row quant +7%, (4) RoPE table +7%, (5) fast_expf +5%, (6) NEON rmsnorm/attn/quant minor gains each. At hardware bandwidth limit."}}
